{
  "$schema": "../schema/book.schema.json",
  "id": "book_01",
  "number": 1,
  "title": "Foundations",
  "subtitle": "First steps into memory",
  "description": "Ten lessons introducing the path of kanji, music, and landscape.",
  "lesson_start": 1,
  "lesson_end": 10,
  "lesson_ids": [
    "lesson_001",
    "lesson_002",
    "lesson_003",
    "lesson_004",
    "lesson_005",
    "lesson_006",
    "lesson_007",
    "lesson_008",
    "lesson_009",
    "lesson_010"
  ],
  "status": "draft",
  "publication": {
    "website": false,
    "youtube_playlist_id": null
  },
  "cover": "media/books/book_01/cover.png",
  "path": "books/book_01/index.html",
  "tags": ["foundations", "beginner"]
}
